{
  "$schema": "https://json-schema.org/draft/2020-12/schema",
  "$id": "evaluation-run.schema.json",
  "title": "Evaluation Run",
  "description": "Binds an evaluation to one subject and configuration. A recorded result is not deployment approval, certification, or proof of real-world accuracy.",
  "type": "object",
  "additionalProperties": false,
  "properties": {
    "schema_version": {
      "type": "string",
      "const": "1.0.0",
      "minLength": 1
    },
    "evaluation_id": {
      "type": "string",
      "minLength": 1
    },
    "subject_id": {
      "type": "string",
      "minLength": 1
    },
    "configuration_digest": {
      "type": "string",
      "pattern": "^sha256:[a-f0-9]{64}$"
    },
    "dataset_ref": {
      "type": "string",
      "minLength": 1
    },
    "model_ref": {
      "type": "string",
      "minLength": 1
    },
    "method": {
      "type": "string",
      "minLength": 1
    },
    "environment": {
      "type": "string",
      "minLength": 1
    },
    "metrics": {
      "type": "array",
      "minItems": 1,
      "items": {
        "type": "string",
        "minLength": 1
      }
    },
    "limitations": {
      "type": "array",
      "minItems": 1,
      "items": {
        "type": "string",
        "minLength": 1
      }
    },
    "result": {
      "type": "string",
      "minLength": 1
    },
    "evaluated_at": {
      "type": "string",
      "pattern": "^\\d{4}-\\d{2}-\\d{2}T\\d{2}:\\d{2}:\\d{2}Z$"
    },
    "evaluator_ref": {
      "type": "string",
      "minLength": 1
    },
    "independence_note": {
      "type": "string",
      "minLength": 1
    },
    "reference_only": {
      "type": "boolean",
      "const": true
    },
    "authority_effect": {
      "type": "string",
      "const": "NONE",
      "minLength": 1
    }
  },
  "required": [
    "schema_version",
    "evaluation_id",
    "subject_id",
    "configuration_digest",
    "dataset_ref",
    "model_ref",
    "method",
    "environment",
    "metrics",
    "limitations",
    "result",
    "evaluated_at",
    "evaluator_ref",
    "independence_note",
    "reference_only",
    "authority_effect"
  ]
}
